{
  "schema_version": "1.0",
  "report_id": "2026-09-26-IR-TSE-1200",
  "market": "iran_stock",
  "generated_at": "2026-09-26T12:01:00+03:30",
  "agent": {
    "name": "Market Scout",
    "target_model": "GPT-5.6 Sol",
    "reasoning_requested": "High",
    "role": "discovery_and_screening"
  },
  "market_status": {
    "status": "Bearish",
    "action": "Selective",
    "action_bias": "Weak",
    "total_index": {
      "value": 7139743,
      "change_points": -117303,
      "status": "verified_from_available_snapshot"
    },
    "equal_weight_index": {
      "value": 1927000,
      "change_percent": -0.6,
      "status": "approximate_secondary_snapshot"
    },
    "real_money_flow_market": "DATA_NOT_VERIFIED",
    "buy_sell_queues_market": "DATA_NOT_VERIFIED",
    "note": "Broad selling pressure dominated after a positive pre-open; selection must prioritize relative strength and verified tape quality."
  },
  "candidates": [
    {
      "rank": 1,
      "symbol": "شاملا",
      "core_fundamental": "UNCHANGED / SCORE_NOT_VERIFIED",
      "fundamental_status": "UNCHANGED",
      "technical_score": 81,
      "technical_score_status": "PROVISIONAL",
      "tape_score": 89,
      "news_status": "Neutral",
      "relative_volume": "DATA_NOT_VERIFIED",
      "money_flow": "Strong Positive",
      "last_price_rial": 39550,
      "last_change_percent": 2.99,
      "closing_price_rial": 39550,
      "closing_change_percent": 2.99,
      "real_money_inflow_toman_billion": 58.1,
      "buyer_to_seller_power": 3.2,
      "trend": "Bullish, near major upper resistance",
      "support": "39000 / 38940 observed depth zone",
      "resistance": "41730 52-week high",
      "breakout_status": "Not confirmed",
      "potential_entry": "Prefer retest or confirmed break above 41730; avoid chasing queue",
      "stop": "DATA_NOT_VERIFIED",
      "target_1": 41730,
      "target_2": "DATA_NOT_VERIFIED",
      "risk_reward": "R/R >= 2 NOT_VERIFIED at current price",
      "main_catalyst": "Strong buyer power, positive real-money flow, upper-limit strength in a weak market",
      "main_risk": "Close to 52-week high",
      "label": "Early Candidate / Momentum Watch"
    },
    {
      "rank": 2,
      "symbol": "فصبا",
      "core_fundamental": "SCORE_NOT_VERIFIED",
      "fundamental_status": "UNCHANGED",
      "technical_score": "DATA_NOT_VERIFIED",
      "tape_score": 91,
      "news_status": "Neutral",
      "relative_volume": "DATA_NOT_VERIFIED",
      "money_flow": "Strong Positive",
      "last_price_rial": 3910,
      "last_change_percent": 2.89,
      "closing_price_rial": 3870,
      "closing_change_percent": 1.84,
      "day_high_rial": 3910,
      "day_low_rial": 3690,
      "volume_shares": 91700000,
      "real_money_inflow_toman_billion": 67.9,
      "buyer_to_seller_power": 4.41,
      "trend": "Bullish",
      "support": "3690 intraday",
      "resistance": "4070 52-week high",
      "breakout_status": "Near breakout, not confirmed",
      "potential_entry": "Prefer successful retest; do not chase at 3910",
      "stop": "Break below 3690 under the short-term retest scenario",
      "target_1": 4070,
      "target_2": "DATA_NOT_VERIFIED",
      "risk_reward": "Below Scout standard at 3910 / R-R>=2 not verified",
      "main_catalyst": "Real-money inflow, 4.41x buyer power, relative strength",
      "main_risk": "Close to yearly high and elevated valuation",
      "label": "Momentum Watch - NOT YET Hunter"
    },
    {
      "rank": 3,
      "symbol": "شپاس",
      "core_fundamental": "SCORE_NOT_VERIFIED",
      "fundamental_status": "UNCHANGED",
      "technical_score": "DATA_NOT_VERIFIED",
      "tape_score": 84,
      "news_status": "Industry-sensitive to macro/geopolitical news",
      "relative_volume": "DATA_NOT_VERIFIED",
      "money_flow": "Positive",
      "last_price_rial": 44870,
      "last_change_percent": 2.98,
      "closing_price_rial": 44490,
      "closing_change_percent": 2.11,
      "day_high_rial": 44870,
      "day_low_rial": 43010,
      "real_money_inflow_toman_billion": 48.7,
      "buyer_to_seller_power": 2.19,
      "trend": "Short-term strengthening; medium-term requires confirmation",
      "support": "43010 intraday",
      "resistance": "Intermediate resistance DATA_NOT_VERIFIED; 58200 52-week high",
      "breakout_status": "Reversal / momentum attempt",
      "potential_entry": "After holding 43000-44000 area with continued demand confirmation",
      "stop": "Break below 43010 under short-term scenario",
      "target_1": "DATA_NOT_VERIFIED",
      "target_2": "58200 is 52-week high, not a confirmed target",
      "risk_reward": "Potentially attractive but not fully verified",
      "main_catalyst": "Positive money flow, buyer power, lower valuation",
      "main_risk": "Oil-sector and geopolitical sensitivity",
      "label": "Early Candidate"
    }
  ],
  "top_5": [
    {"rank": 1, "symbol": "شاملا", "technical": "81 PROVISIONAL", "tape": 89, "view": "Strongest technical+tape combination"},
    {"rank": 2, "symbol": "فصبا", "technical": "DATA_NOT_VERIFIED", "tape": 91, "view": "Strongest tape; too close to major high"},
    {"rank": 3, "symbol": "شپاس", "technical": "DATA_NOT_VERIFIED", "tape": 84, "view": "Best early setup among verified candidates"}
  ],
  "best_early_candidate": "شپاس",
  "best_momentum_hunter": "NONE - R/R >= 2 not verified",
  "best_potential_prime": "NONE - valid Core Fundamental >= 70 not verified",
  "data_quality": {
    "weak_candidates_used_to_fill_list": false,
    "qualified_candidates_count": 3,
    "market_real_money_flow": "DATA_NOT_VERIFIED",
    "market_queue_snapshot": "DATA_NOT_VERIFIED",
    "technical_limitations": "Only شاملا has a provisional technical score based on latest complete indicators plus current tape; full same-day EMA/RSI/MACD validation was unavailable for other finalists.",
    "rule": "No guessed numbers; unavailable fields remain DATA_NOT_VERIFIED."
  }
}
