{
  "schema_version":"1.0","report_id":"2026-09-25-IR-TSE-1200","market":"iran_stock","generated_at":"2026-09-25T12:00:00+03:30",
  "agent":{"role":"scout","model":"gpt-5.6-sol","reasoning":"high"},"market_status":{"state":"NEUTRAL"},
  "candidates":[{"symbol":"FMLI","core_fundamental_score":84,"daily_valuation_score":78,"technical_score":77,"tape_score":75,"news_score":70,"daily_opportunity_score":77.35,"risk_reward":2.3,"critical_news_risk":false,"label":"POTENTIAL_PRIME"}],
  "top_5":["FMLI"],"best_early_candidate":null,"best_momentum_hunter":null,"best_potential_prime":"FMLI","data_quality":{"not_verified":[],"conflicts":[]}
}